{
  "$schema": "https://json-schema.org/draft/2020-12/schema",
  "$id": "https://in-progress.local/schemas/in-progress-config.schema.json",
  "title": "in-progress configuration",
  "description": "Static project, plugin, trusted integration, terminal, server, and notification configuration for in-progress.",
  "type": "object",
  "additionalProperties": false,
  "required": ["projects"],
  "properties": {
    "$schema": {
      "type": "string",
      "description": "Optional editor schema reference; accepted and ignored at runtime."
    },
    "server": {
      "type": "object",
      "additionalProperties": false,
      "default": {},
      "properties": {
        "host": {
          "type": "string",
          "default": "127.0.0.1",
          "description": "Listen address. Non-loopback values also require IN_PROGRESS_UNSAFE_BIND=1."
        },
        "port": {
          "type": "integer",
          "minimum": 0,
          "maximum": 65535,
          "default": 4317
        },
        "allowedOrigins": {
          "type": "array",
          "items": {
            "type": "string",
            "format": "uri"
          },
          "default": [],
          "description": "Additional exact browser origins accepted for mutations and WebSocket upgrades."
        },
        "allowedTailscaleUsers": {
          "type": "array",
          "items": {
            "type": "string",
            "format": "email"
          },
          "default": [],
          "description": "Allowlist for a present Tailscale-User-Login. Empty accepts any present login permitted by tailnet policy; proxy-marked requests without identity are rejected."
        }
      }
    },
    "projects": {
      "type": "array",
      "minItems": 1,
      "items": {
        "$ref": "#/$defs/project"
      }
    },
    "pluginDirectories": {
      "type": "array",
      "items": {
        "type": "string"
      },
      "default": [],
      "description": "Plugin roots or directories whose immediate children are plugin roots."
    },
    "integrations": {
      "type": "object",
      "additionalProperties": false,
      "default": {},
      "description": "Trusted host-side adapters for fixed native tools. Plugin manifests cannot configure executable authority.",
      "properties": {
        "align": {
          "type": "object",
          "additionalProperties": false,
          "required": ["sourceDirectory"],
          "properties": {
            "sourceDirectory": {
              "type": "string",
              "minLength": 1,
              "description": "Align checkout containing src/align; relative paths resolve from this config file."
            },
            "pythonExecutable": {
              "type": "string",
              "minLength": 1,
              "default": "/usr/bin/python3",
              "description": "Existing Python executable used with an isolated -I -B -S bootstrap into the fixed Align source for status and one-shot local initialization."
            }
          }
        },
        "drift": {
          "type": "object",
          "additionalProperties": false,
          "required": ["executable"],
          "properties": {
            "executable": {
              "type": "string",
              "minLength": 1,
              "description": "Existing Drift executable; relative paths resolve from this config file."
            },
            "codexExecutable": {
              "type": "string",
              "minLength": 1,
              "default": "/usr/bin/codex",
              "description": "Authenticated Codex CLI used only for confirmed Drift trace analysis."
            },
            "sessionsDirectory": {
              "type": "string",
              "minLength": 1,
              "default": "~/.codex/sessions",
              "description": "Existing Codex rollout root, disjoint from every configured project, used for project-matched recent-session discovery and confirmed local import."
            }
          }
        },
        "preview": {
          "type": "object",
          "additionalProperties": false,
          "required": ["sourceDirectory", "artifactDirectory"],
          "properties": {
            "sourceDirectory": {
              "type": "string",
              "minLength": 1,
              "description": "Preview checkout containing bin/preview; relative paths resolve from this config file."
            },
            "artifactDirectory": {
              "type": "string",
              "minLength": 1,
              "description": "Existing Preview state/output root, disjoint from every configured project; its in-progress-plugin package is installed automatically and ecosystem build initializes its local-only Git history."
            },
            "codexExecutable": {
              "type": "string",
              "minLength": 1,
              "default": "/usr/bin/codex",
              "description": "Authenticated Codex CLI. Preview requires stored ChatGPT login and strips API credential environment overrides."
            }
          }
        },
        "treeComplete": {
          "type": "object",
          "additionalProperties": false,
          "required": ["sourceDirectory"],
          "properties": {
            "sourceDirectory": {
              "type": "string",
              "minLength": 1,
              "description": "Tree Complete checkout with a built embedded service; relative paths resolve from this config file."
            },
            "mode": {
              "type": "string",
              "enum": ["preview", "codex"],
              "default": "preview",
              "description": "Preview writes host-owned simulation state without project/Git mutation; codex requires each project's committed .tree-complete/project.json, creates Git worktrees/branches, and runs unsandboxed Codex after explicit confirmation."
            }
          }
        }
      }
    },
    "terminal": {
      "type": "object",
      "additionalProperties": false,
      "default": {},
      "description": "Named zmx-backed project Terminal sessions.",
      "properties": {
        "shell": {
          "type": "string",
          "description": "Inner zmx session shell executable. Defaults to SHELL, then /bin/sh."
        },
        "shellArgs": {
          "type": "array",
          "maxItems": 16,
          "items": {
            "type": "string",
            "maxLength": 256
          },
          "default": ["-l"]
        },
        "scrollbackBytes": {
          "type": "integer",
          "minimum": 65536,
          "maximum": 16777216,
          "default": 1048576,
          "description": "Per-session host replay ring size in bytes; zmx separately owns terminal-state restoration."
        },
        "maxSessionsPerProject": {
          "type": "integer",
          "minimum": 1,
          "maximum": 24,
          "default": 8
        }
      }
    },
    "notifications": {
      "type": "object",
      "additionalProperties": false,
      "default": {},
      "properties": {
        "vapidSubject": {
          "type": "string",
          "pattern": "^(mailto:|https:\\/\\/)",
          "default": "mailto:in-progress@localhost",
          "description": "VAPID contact URI sent to push services."
        }
      }
    }
  },
  "$defs": {
    "project": {
      "type": "object",
      "additionalProperties": false,
      "required": ["id", "name", "path"],
      "properties": {
        "id": {
          "type": "string",
          "pattern": "^[a-z][a-z0-9-]{1,62}$"
        },
        "name": {
          "type": "string",
          "minLength": 1,
          "maxLength": 64
        },
        "path": {
          "type": "string",
          "minLength": 1,
          "description": "Existing project directory; relative paths resolve from the config file."
        },
        "color": {
          "type": "string",
          "pattern": "^#[0-9a-fA-F]{6}$",
          "default": "#67d5b5"
        }
      }
    }
  }
}
