{
  "$schema": "./docs/in-progress-config.schema.json",
  "server": {
    "host": "127.0.0.1",
    "port": 4317
  },
  "projects": [
    {
      "id": "in-progress",
      "name": "in-progress",
      "path": ".",
      "color": "#67d5b5"
    }
  ],
  "pluginDirectories": ["./examples/plugins"],
  "terminal": {
    "scrollbackBytes": 1048576
  },
  "notifications": {
    "vapidSubject": "mailto:in-progress@localhost"
  }
}
